{
  "approach": "Use deterministic canned model output.",
  "engine": {
    "label": "claude:opus"
  },
  "model_tier": "fixture",
  "open_questions": [],
  "parallelizable_tasks": [
    "ck-a100"
  ],
  "risks": [],
  "steps": [
    "plan",
    "fanout"
  ],
  "summary": "watchdog-table-config plan from claude:opus"
}