{
  "approach": "Use deterministic canned model output.",
  "engine": {
    "label": "claude:opus"
  },
  "model_tier": "fixture",
  "open_questions": [],
  "parallelizable_tasks": [
    "T1",
    "T2"
  ],
  "risks": [],
  "steps": [
    "plan",
    "fanout"
  ],
  "summary": "legacy-ordinal-ids plan from claude:opus"
}