{
  "approach": "Use deterministic canned model output.",
  "engine": {
    "label": "codex:gpt-5.5"
  },
  "model_tier": "fixture",
  "open_questions": [],
  "parallelizable_tasks": [
    "ck-b200"
  ],
  "risks": [],
  "steps": [
    "plan",
    "fanout"
  ],
  "summary": "grown-schema-task plan from codex:gpt-5.5"
}